{
  "schema_version": "1.0",
  "captured_at": "2026-05-13T05:18:13.035189+00:00",
  "modules": [
    {
      "module": "utils.virtual_bank",
      "loaded": true,
      "line_count": 717,
      "has_self_test": false,
      "self_test_passed": null,
      "self_test_duration_s": 0.0,
      "error": null
    },
    {
      "module": "utils.virtual_bank_core",
      "loaded": true,
      "line_count": 1167,
      "has_self_test": true,
      "self_test_passed": true,
      "self_test_duration_s": 0.001,
      "error": null
    },
    {
      "module": "utils.virtual_bank_simulator",
      "loaded": true,
      "line_count": 1323,
      "has_self_test": true,
      "self_test_passed": true,
      "self_test_duration_s": 0.003,
      "error": null
    },
    {
      "module": "utils.scenario_simulator",
      "loaded": true,
      "line_count": 18026,
      "has_self_test": true,
      "self_test_passed": true,
      "self_test_duration_s": 0.169,
      "error": null
    },
    {
      "module": "utils.stress_testing",
      "loaded": true,
      "line_count": 591,
      "has_self_test": true,
      "self_test_passed": true,
      "self_test_duration_s": 0.001,
      "error": null
    },
    {
      "module": "utils.strategy_simulator",
      "loaded": true,
      "line_count": 628,
      "has_self_test": false,
      "self_test_passed": null,
      "self_test_duration_s": 0.0,
      "error": null
    },
    {
      "module": "utils.hybrid_scheduling_simulator",
      "loaded": true,
      "line_count": 491,
      "has_self_test": false,
      "self_test_passed": null,
      "self_test_duration_s": 0.0,
      "error": null
    },
    {
      "module": "utils.liquidity_stress",
      "loaded": true,
      "line_count": 744,
      "has_self_test": true,
      "self_test_passed": true,
      "self_test_duration_s": 0.001,
      "error": null
    }
  ],
  "boot": {
    "bank_instantiated": true,
    "simulator_instantiated": true,
    "run_configured": true,
    "run_executed": true,
    "final_customers": 0,
    "final_accounts": 0,
    "final_transactions": 0,
    "duration_s": 0.0,
    "error": null
  },
  "coverage": {
    "total_active_staff": 1439,
    "staff_with_kpi_mapping": 1439,
    "bsc_records": 123,
    "bsc_unique_staff": 40,
    "bsc_coverage_pct": 2.78,
    "kpi_library_dangling_refs": 34,
    "kpi_library_unused_kpis": 26,
    "departments_clean_bsc_submission": 22,
    "departments_failed_bsc_submission": 0,
    "error": null
  },
  "scenarios": {
    "scenarios_attempted": 4,
    "scenarios_passed": 4,
    "scenarios_failed": 0,
    "scenarios_errored": 0,
    "duration_s": 0.001,
    "sample_scenario_ids": [
      "LI-01",
      "LI-02",
      "IRRBB-01",
      "CAP-01"
    ],
    "error": null
  },
  "chain": {
    "teller_action_to_cbs": "PARTIAL",
    "cbs_to_actuals_engine": "WIRED",
    "actuals_engine_to_yoy_sidecar": "WIRED",
    "yoy_sidecar_to_bsc_display": "WIRED",
    "bsc_to_branch_score": "WIRED",
    "branch_to_regional_rollup": "WIRED",
    "regional_to_md_tile": "PARTIAL",
    "end_to_end_verified": false,
    "notes": [
      "Link 1 (teller \u2192 CBS): virtual_bank_simulator generates transactions in VirtualBankCore memory but does not persist to cbs_data/*.json. A bridge module is needed for end-to-end CBS persistence.",
      "Link 7 (regional \u2192 MD): MD BSC roadmap item 2 (bank-targets binding) not yet closed. The mechanical rollup exists but the MD-level 'on track?' tile that Charter \u00a72 requires is not yet end-to-end.",
      "End-to-end verification (Charter \u00a72 Football Team Test) requires Links 1 and 7 to close + an integration test that fires a synthetic teller transaction and asserts it propagates to the MD tile within reasonable latency. Candidate for v10.358."
    ]
  },
  "overall_status": "READY_BUT_NOT_VERIFIED",
  "blockers": [],
  "notes": [
    "BSC coverage at 2.8% \u2014 only 40 of 1,439 active staff have actuals. Driving this to 100% is the live bring-up's primary objective.",
    "Boot probe ran the simulator against an empty VirtualBankCore \u2014 0 customers/accounts/transactions generated. A seed-the-bank step is the prerequisite for meaningful end-to-end runs. Candidate for v10.358 (Football Team Test harness) or earlier."
  ],
  "_doc": "Virtual bank readiness audit output. Regenerated by utils.virtual_bank_readiness.capture_readiness_report(). Inputs the v10.358+ Football Team Test work.",
  "_schema_version": "1.0"
}